{
 "meta": {
  "title": "Example upgrade plan",
  "date": "2026-09-30",
  "clusters": [
   "cluster-a",
   "cluster-b"
  ],
  "path": [
   "1.31",
   "1.32",
   "1.33",
   "1.34",
   "1.35",
   "1.36"
  ],
  "phases": [
   {
    "name": "Phase 1",
    "until": "1.33"
   },
   {
    "name": "Phase 2",
    "until": "1.36"
   }
  ],
  "facts": [
   "cluster-a v1.31.0 (kubeadm)",
   "cluster-b v1.31.4 (kubespray)"
  ]
 },
 "summary": [
  {
   "severity": "blocker",
   "title": "1.33 is already end of life",
   "text": "Support ended 2026-06-28. Treat it as a stop along the way, not a destination."
  },
  {
   "severity": "blocker",
   "title": "containerd 1.x on nodes",
   "text": "Nodes run containerd 1.x, which 1.36 does not support."
  },
  {
   "severity": "required",
   "title": "cluster-a: nodes not ready",
   "text": "cluster-a-worker-gpu-03 must be fixed or removed before upgrading."
  }
 ],
 "snapshot": [
  {
   "item": "Installer",
   "values": {
    "cluster-a": "kubeadm (kubeadm-config ConfigMap present)",
    "cluster-b": "kubespray (certificatesDir /etc/kubernetes/ssl (kubeadm default is /etc/kubernetes/pki); dns-autoscaler Deployment)"
   }
  },
  {
   "item": "API server",
   "values": {
    "cluster-a": "v1.31.0",
    "cluster-b": "v1.31.4"
   }
  },
  {
   "item": "Kubelets",
   "values": {
    "cluster-a": "v1.31.2 \u00d744",
    "cluster-b": "v1.31.4 \u00d774"
   }
  },
  {
   "item": "Control-plane nodes",
   "values": {
    "cluster-a": 5,
    "cluster-b": 6
   }
  },
  {
   "item": "etcd",
   "values": {
    "cluster-a": "stacked \u00d75 3.5.15-0",
    "cluster-b": "external \u00d73"
   }
  },
  {
   "item": "containerd",
   "values": {
    "cluster-a": "containerd://1.7.24 \u00d75, containerd://1.7.27 \u00d720, containerd://1.7.28 \u00d72, containerd://2.2.1 \u00d717",
    "cluster-b": "containerd://1.7.24 \u00d774"
   }
  },
  {
   "item": "OS",
   "values": {
    "cluster-a": "Ubuntu 24.04.2 LTS \u00d77, Ubuntu 24.04.3 LTS \u00d72, Ubuntu 24.04.4 LTS \u00d717, Ubuntu 24.04.5 LTS \u00d718",
    "cluster-b": "Ubuntu 22.04.3 LTS \u00d75, Ubuntu 22.04.4 LTS \u00d74, Ubuntu 22.04.5 LTS \u00d765"
   }
  },
  {
   "item": "Kernel",
   "values": {
    "cluster-a": "6.8.0-124-generic \u00d710, 6.8.0-136-generic \u00d77, 6.8.0-139-generic \u00d71, 6.8.0-142-generic \u00d717, 6.8.0-55-generic \u00d75, 6.8.0-64-generic \u00d73, 6.8.0-88-generic \u00d71",
    "cluster-b": "5.15.0-105-generic \u00d71, 5.15.0-118-generic \u00d71, 5.15.0-119-generic \u00d75, 5.15.0-121-generic \u00d71, 5.15.0-130-generic \u00d756, 5.15.0-131-generic \u00d71, 5.15.0-163-generic \u00d73, 5.15.0-171-generic \u00d72, 5.15.0-185-generic \u00d72, 5.15.0-78-generic \u00d71, 5.15.0-92-generic \u00d71"
   }
  },
  {
   "item": "kube-proxy",
   "values": {
    "cluster-a": "ipvs \u00b7 v1.31.0",
    "cluster-b": "ipvs \u00b7 v1.31.4"
   }
  },
  {
   "item": "CNI",
   "values": {
    "cluster-a": "calico tigera-operator v3.29.1",
    "cluster-b": "calico manifest v3.29.1"
   }
  },
  {
   "item": "CoreDNS",
   "values": {
    "cluster-a": "v1.11.3 \u00b7 2 replicas",
    "cluster-b": "v1.11.3 \u00b7 20 replicas"
   }
  },
  {
   "item": "NodeLocal DNS",
   "values": {
    "cluster-a": "node-local-dns",
    "cluster-b": "node-local-dns, node-local-dns-controlplane"
   }
  },
  {
   "item": "Nodes not ready",
   "values": {
    "cluster-a": "cluster-a-worker-gpu-03",
    "cluster-b": "none"
   }
  }
 ],
 "support": [
  {
   "minor": "1.31",
   "released": "2024-08-13",
   "eol": "2025-11-11",
   "latest": "1.31.14",
   "isEol": true
  },
  {
   "minor": "1.32",
   "released": "2024-12-11",
   "eol": "2026-02-28",
   "latest": "1.32.13",
   "isEol": true
  },
  {
   "minor": "1.33",
   "released": "2025-04-23",
   "eol": "2026-06-28",
   "latest": "1.33.13",
   "isEol": true
  },
  {
   "minor": "1.34",
   "released": "2025-08-27",
   "eol": "2026-10-27",
   "latest": "1.34.12",
   "isEol": false
  },
  {
   "minor": "1.35",
   "released": "2025-12-17",
   "eol": "2027-02-28",
   "latest": "1.35.9",
   "isEol": false
  },
  {
   "minor": "1.36",
   "released": "2026-04-22",
   "eol": "2027-06-28",
   "latest": "1.36.5",
   "isEol": false
  }
 ],
 "nodeLayer": [
  {
   "item": "containerd",
   "severity": "blocker",
   "neededBy": "before 1.36",
   "current": "cluster-a: containerd://1.7.24 \u00d75, containerd://1.7.27 \u00d720, containerd://1.7.28 \u00d72, containerd://2.2.1 \u00d717; cluster-b: containerd://1.7.24 \u00d774",
   "problem": "Kubernetes 1.36 does not support containerd 1.x; 1.35 is the last release that does.",
   "action": "Hold the package, then move nodes to containerd 2.x (config version 3, certs.d mirrors, new sandbox image key) at the 1.34 or 1.35 stage.",
   "refs": [
    {
     "title": "containerd releases and Kubernetes support",
     "url": "https://github.com/containerd/containerd/blob/main/RELEASES.md"
    }
   ]
  },
  {
   "item": "kube-proxy IPVS",
   "severity": "required",
   "neededBy": "before 1.37",
   "current": "ipvs on cluster-a, cluster-b",
   "problem": "IPVS mode is deprecated in 1.35 and being removed.",
   "action": "Move to iptables (or nftables with kernel 5.13+). Re-test NodeLocal DNS, which is set up differently per mode.",
   "refs": [
    {
     "title": "kube-proxy modes",
     "url": "https://kubernetes.io/docs/reference/networking/virtual-ips/"
    }
   ]
  },
  {
   "item": "etcd (cluster-a, stacked)",
   "severity": "recommended",
   "neededBy": "1.34 hop",
   "current": "stacked \u00d75 3.5.15-0",
   "problem": "kubeadm 1.34 moves stacked etcd to 3.6, with no downgrade.",
   "action": "Take an etcd snapshot and back up /etc/kubernetes before the 1.34 hop.",
   "refs": [
    {
     "title": "etcd 3.6 upgrade",
     "url": "https://etcd.io/docs/v3.6/upgrades/upgrade_3_6/"
    }
   ]
  },
  {
   "item": "kubelet config (cluster-a)",
   "severity": "required",
   "neededBy": "every hop",
   "current": "kube-system/kubelet-config ConfigMap",
   "problem": "kubeadm upgrade node rewrites /var/lib/kubelet/config.yaml from the ConfigMap, dropping per-node settings applied after join.",
   "action": "Compare a node's config.yaml with the ConfigMap; put custom settings into the ConfigMap or re-apply them after each hop.",
   "refs": [
    {
     "title": "Reconfiguring a kubeadm cluster",
     "url": "https://kubernetes.io/docs/tasks/administer-cluster/kubeadm/kubeadm-reconfigure/"
    }
   ]
  }
 ],
 "components": [
  {
   "id": "calico",
   "name": "calico",
   "severity": "required",
   "current": {
    "cluster-a": "3.29.1",
    "cluster-b": "3.29.1"
   },
   "targets": {
    "Phase 1": "3.30",
    "Phase 2": "3.32"
   },
   "notes": "1.31: eager: wider support available; 1.34: eager: wider support available",
   "refs": [
    {
     "title": "calico compatibility",
     "url": "https://docs.tigera.io/calico/latest/getting-started/kubernetes/requirements"
    }
   ]
  },
  {
   "id": "cert-manager",
   "name": "cert-manager",
   "severity": "required",
   "current": {
    "cluster-a": "1.17.4",
    "cluster-b": "1.17.4"
   },
   "targets": {
    "Phase 1": "1.21",
    "Phase 2": "1.21"
   },
   "notes": "1.31: eager: wider support available; 1.33: eager: wider support available",
   "refs": [
    {
     "title": "cert-manager compatibility",
     "url": "https://cert-manager.io/docs/releases/"
    }
   ]
  },
  {
   "id": "ingress-nginx",
   "name": "ingress-nginx",
   "severity": "blocker",
   "current": {
    "cluster-a": "1.12.1",
    "cluster-b": "1.12.1"
   },
   "targets": {
    "Phase 1": "1.15",
    "Phase 2": "1.15"
   },
   "notes": "no known ingress-nginx version supports both 1.35 and 1.36; 1.31: eager: wider support available; Project archived 2026-03-24; no release supports 1.36.",
   "refs": [
    {
     "title": "ingress-nginx compatibility",
     "url": "https://github.com/kubernetes/ingress-nginx#supported-versions-table"
    }
   ]
  },
  {
   "id": "istio",
   "name": "istio",
   "severity": "required",
   "current": {
    "cluster-a": "1.27.3",
    "cluster-b": "1.27.3"
   },
   "targets": {
    "Phase 1": "1.30",
    "Phase 2": "1.30"
   },
   "notes": "1.31: eager: wider support available; 1.32: eager: wider support available",
   "refs": [
    {
     "title": "istio compatibility",
     "url": "https://istio.io/latest/docs/releases/supported-releases/"
    }
   ]
  },
  {
   "id": "metrics-server",
   "name": "metrics-server",
   "severity": "ok",
   "current": {
    "cluster-a": "0.7.2",
    "cluster-b": "0.7.2"
   },
   "targets": {
    "Phase 1": "0.7",
    "Phase 2": "0.7"
   },
   "notes": "",
   "refs": [
    {
     "title": "metrics-server compatibility",
     "url": "https://github.com/kubernetes-sigs/metrics-server#compatibility-matrix"
    }
   ]
  },
  {
   "id": "velero",
   "name": "velero",
   "severity": "blocker",
   "current": {
    "cluster-a": "1.11.0",
    "cluster-b": "1.11.0"
   },
   "targets": {
    "Phase 1": "1.18",
    "Phase 2": "1.18"
   },
   "notes": "no known velero version supports both 1.35 and 1.36; 1.31: 1.11 does not support 1.32; 1.33: eager: wider support available; Ranges are the tested versions; expected compatibility is wider.",
   "refs": [
    {
     "title": "velero compatibility",
     "url": "https://github.com/vmware-tanzu/velero#velero-compatibility-matrix"
    }
   ]
  }
 ],
 "matrix": {
  "hops": [
   "1.31",
   "1.32",
   "1.33",
   "1.34",
   "1.35",
   "1.36"
  ],
  "rows": [
   {
    "component": "calico",
    "clusters": [
     "cluster-a",
     "cluster-b"
    ],
    "current": "3.29.1",
    "status": "upgrade",
    "steps": {
     "1.31": "3.29 \u2192 3.30",
     "1.34": "3.30 \u2192 3.31 \u2192 3.32"
    },
    "final": "3.32",
    "newestForFinal": null,
    "rule": {
     "maxMinorStep": 1
    },
    "refs": [
     {
      "title": "calico compatibility",
      "url": "https://docs.tigera.io/calico/latest/getting-started/kubernetes/requirements"
     }
    ],
    "id": "calico"
   },
   {